{
  "$schema": "https://example.invalid/ai-migration-framework/schemas/evidence.schema.json",
  "schema_version": "2.0",
  "id": "EVID-0003",
  "phase": "characterize",
  "slice_id": null,
  "gate": "source-characterization",
  "status": "pass",
  "command": "ctest --test-dir build -R 'catalog_create_golden|order_equal_priority'",
  "environment": {"compiler": "reference-toolchain", "locale": "C"},
  "artifacts": ["characterization/catalog-create.xml", "characterization/order-equal-priority.xml"],
  "contracts": ["BEH-0001", "BEH-0002"],
  "recorded_at": "2026-01-01T00:02:30Z"
}
