{
  "$schema": "https://example.invalid/ai-migration-framework/schemas/evidence.schema.json",
  "schema_version": "2.0",
  "id": "EVID-0001",
  "phase": "verify",
  "slice_id": "SLICE-0002",
  "gate": "differential-ordering",
  "status": "fail",
  "command": "./gradlew differentialTest --tests order_equal_priority",
  "environment": {"jdk": "25", "locale": "C"},
  "artifacts": ["reports/differential/order-equal-priority-first-run.xml"],
  "contracts": ["BEH-0002"],
  "recorded_at": "2026-01-01T00:08:00Z"
}
